<?xml version="1.0" encoding="UTF-8"?>
<CIUDADES xmlns:xsi="http://www.w3.org/2001/XMLSchema-instance">
            xsi:noNamespaceSchemaLocation="ciudades.xsd">
    <CIUDAD>
        <NOMBRE>Nueva Delhi</NOMBRE>
        <PAIS>India</PAIS>
        <CONTINENTE>Asia</CONTINENTE>
    </CIUDAD>
    <CIUDAD>
        <NOMBRE>Lisboa</NOMBRE>
        <PAIS>Portugal</PAIS>
        <CONTINENTE>Europa</CONTINENTE>
    </CIUDAD>
    <CIUDAD>
        <NOMBRE>El Cairo</NOMBRE>
        <PAIS>Egipto</PAIS>
        <CONTINENTE>África</CONTINENTE>
    </CIUDAD>
</CIUDADES>